{
  "$schema": "https://json-schema.org/draft/2020-12/schema",
  "$id": "https://observeos.local/contracts/client_event.schema.json",
  "title": "Client Event Envelope",
  "type": "object",
  "required": [
    "schema_version",
    "tenant_id",
    "device_id",
    "event_id",
    "idempotency_key",
    "event_type",
    "occurred_at",
    "captured_at",
    "payload"
  ],
  "properties": {
    "schema_version": { "const": "1.0" },
    "tenant_id": { "type": "string", "minLength": 1 },
    "device_id": { "type": "string", "minLength": 1 },
    "event_id": { "type": "string", "format": "uuid" },
    "idempotency_key": { "type": "string", "minLength": 1 },
    "event_type": {
      "type": "string",
      "enum": ["activity", "idle", "session.start", "session.end", "heartbeat", "policy", "sync_error"]
    },
    "occurred_at": { "type": "string", "format": "date-time" },
    "captured_at": { "type": "string", "format": "date-time" },
    "payload": { "type": "object" }
  },
  "additionalProperties": false
}
