{
  "schema_version": "1.0",
  "tenant_id": "tenant-1",
  "device_id": "device-1",
  "event_id": "11111111-1111-4111-8111-111111111111",
  "idempotency_key": "device-1:11111111-1111-4111-8111-111111111111",
  "event_type": "activity",
  "occurred_at": "2026-06-20T10:00:00+00:00",
  "captured_at": "2026-06-20T10:00:01+00:00",
  "payload": {
    "app_name": "code.exe",
    "duration_seconds": 30
  }
}
